{
  "schema": "bililive.diagnostic-bundle/v1",
  "manifest": {
    "bundle_id": "bundle_demo_complex_100_rooms_restart",
    "run_id": "run_demo_complex_100_01",
    "incident_id": "incident_demo_complex_100_01",
    "time_origin": "2026-07-29T10:00:00+09:00",
    "capture_start_ms": 0,
    "capture_end_ms": 63000,
    "synthetic": true,
    "app_version": "demo-next",
    "commit": "synthetic",
    "go_version": "go1.25.1",
    "os": "linux",
    "arch": "amd64",
    "trace_mode": "diagnostic",
    "dropped_events": 0,
    "redaction_version": "demo-v1",
    "sequence_scope": "process_global_observation_order",
    "room_population": {
      "configured": 100,
      "started": 100,
      "fully_traced": 1,
      "representative": 5,
      "aggregate_only": 94
    },
    "title": "100 房间同时启动、手动停启与 generation 交错的 50 秒慢录制"
  },
  "configuration": {
    "room_check_interval_ms": 20000,
    "configured_room_count": 100,
    "startup_monitor_batch_size": 100,
    "platform_limiter_rate_per_second": 1.75,
    "platform_limiter_burst": 10,
    "platform_limiter_semantics": "shared_non_fifo_competition",
    "downloader_type": "native",
    "diagnostic_ttl_ms": 900000
  },
  "entities": [
    {
      "type": "room",
      "id": "room_hmac_demo_target_042",
      "label": "目标直播间",
      "platform": "bilibili",
      "fixture_live_throughout_capture": true
    },
    {
      "type": "room",
      "id": "room_hmac_demo_rep_001",
      "label": "代表房间 001",
      "platform": "bilibili"
    },
    {
      "type": "room",
      "id": "room_hmac_demo_rep_020",
      "label": "代表房间 020",
      "platform": "bilibili"
    },
    {
      "type": "room",
      "id": "room_hmac_demo_rep_050",
      "label": "代表房间 050",
      "platform": "bilibili"
    },
    {
      "type": "room",
      "id": "room_hmac_demo_rep_075",
      "label": "代表房间 075",
      "platform": "bilibili"
    },
    {
      "type": "room",
      "id": "room_hmac_demo_rep_099",
      "label": "代表房间 099",
      "platform": "bilibili"
    },
    {
      "type": "recording_session",
      "id": "recording_demo_complex_g2",
      "label": "目标房间 generation 2 录制会话"
    }
  ],
  "incident": {
    "type": "recording_start_slow_with_manual_restart",
    "title": "恢复监控后仍等待整整 50 秒才写出 FLV",
    "anchor_entity_id": "room_hmac_demo_target_042",
    "anchor_start_event_id": "evt_cx_020",
    "goal_event_id": "evt_cx_057",
    "initial_generation": 1,
    "target_generation": 2,
    "configured_room_count": 100,
    "expected_detection_interval_ms": 20000,
    "observed_monitor_to_first_byte_ms": 50000,
    "observed_resume_to_first_byte_ms": 50000,
    "observed_process_start_to_first_byte_ms": 57052,
    "user_report": "程序同时监控 100 个房间；等待期间手动停止再恢复目标房间，恢复后约 50 秒才真正写出 FLV。",
    "trigger_event_id": "evt_cx_058",
    "known_fixture_truth": "目标房间在整个合成窗口内保持开播"
  },
  "events": [
    {"seq":1,"global_seq":1,"id":"evt_cx_001","at_ms":0,"severity":"info","kind":"instant","name":"process.run.start","component":"process","lane":"进程","flow_id":"flow_process_complex","task_id":"task_process_main","goroutine_id":"g_main_1","attrs":{"configured_room_count":100}},
    {"seq":2,"global_seq":2,"id":"evt_cx_002","at_ms":5,"severity":"info","kind":"instant","name":"monitor.batch.started","component":"listener_manager","lane":"批量初始化","flow_id":"flow_batch_100","task_id":"task_batch_init_100","goroutine_id":"g_main_1","attrs":{"room_count":100,"fully_traced_room_count":1,"representative_room_count":5,"aggregate_only_room_count":94}},
    {"seq":3,"global_seq":3,"id":"evt_cx_003","at_ms":10,"severity":"info","kind":"instant","name":"monitor.started","component":"listener","lane":"目标房间","flow_id":"flow_complex_target","task_id":"task_listener_target_g1","goroutine_id":"g_main_1","generation":1,"entity_id":"room_hmac_demo_target_042","attrs":{"configured_interval_ms":20000,"reason":"startup_batch"}},
    {"seq":4,"global_seq":4,"id":"evt_cx_004","at_ms":12,"severity":"debug","kind":"instant","name":"task.created","component":"live_scheduler","lane":"平台调度","flow_id":"flow_complex_target","task_id":"task_scheduler_request_g1","goroutine_id":"g_scheduler_target_g1","generation":1,"entity_id":"room_hmac_demo_target_042","attrs":{"context_owner":"wrapped_live.scheduler","request_scope":"shared_scheduler_request"},"links":[{"rel":"caused_by","event_id":"evt_cx_003"}]},
    {"seq":5,"global_seq":5,"id":"evt_cx_005","at_ms":15,"severity":"debug","kind":"span.start","name":"listener.poll.start","component":"listener","lane":"目标房间","flow_id":"flow_complex_target","span_id":"span_poll_target_g1","task_id":"task_listener_waiter_g1","goroutine_id":"g_listener_target_g1","generation":1,"entity_id":"room_hmac_demo_target_042","attrs":{"poll_no":1,"reason":"initial_refresh","context_owner":"listener.generation_1"}},
    {"seq":6,"global_seq":6,"id":"evt_cx_006","at_ms":20,"severity":"debug","kind":"span.start","name":"scheduler.rate_limit.wait.start","component":"live_scheduler","lane":"平台共享限流","flow_id":"flow_complex_target","span_id":"span_limiter_target_g1","task_id":"task_scheduler_request_g1","goroutine_id":"g_scheduler_target_g1","generation":1,"entity_id":"room_hmac_demo_target_042","attrs":{"waiter_count_at_enter":23,"recheck_count":0,"context_owner":"wrapped_live.scheduler","cancel_target":"listener.waiter.generation_1","fifo_guaranteed":false}},
    {"seq":7,"global_seq":7,"id":"evt_cx_007","at_ms":100,"severity":"debug","kind":"instant","name":"scheduler.limit.snapshot","component":"live_scheduler","lane":"平台共享限流","flow_id":"flow_batch_100","task_id":"task_batch_init_100","goroutine_id":"g_platform_limiter_20","attrs":{"waiting_rooms":90,"grants_total":10,"configured_rooms":100,"fifo_guaranteed":false}},
    {"seq":8,"global_seq":8,"id":"evt_cx_008","at_ms":300,"severity":"debug","kind":"instant","name":"scheduler.representative_poll.completed","component":"live_scheduler","lane":"代表房间","flow_id":"flow_rep_001","task_id":"task_poll_rep_001","goroutine_id":"g_scheduler_rep_001","generation":1,"entity_id":"room_hmac_demo_rep_001","attrs":{"live":false,"duration_ms":280,"grant_seq":11}},
    {"seq":9,"global_seq":9,"id":"evt_cx_009","at_ms":5000,"severity":"debug","kind":"instant","name":"scheduler.representative_poll.completed","component":"live_scheduler","lane":"代表房间","flow_id":"flow_rep_020","task_id":"task_poll_rep_020","goroutine_id":"g_scheduler_rep_020","generation":1,"entity_id":"room_hmac_demo_rep_020","attrs":{"live":false,"duration_ms":410,"grant_seq":19}},
    {"seq":10,"global_seq":10,"id":"evt_cx_010","at_ms":7000,"severity":"info","kind":"instant","name":"monitor.stop.requested","component":"webui","lane":"用户操作","flow_id":"flow_complex_target","task_id":"task_web_command_stop","goroutine_id":"g_http_webui_610","generation":1,"entity_id":"room_hmac_demo_target_042","attrs":{"source":"webui","request_id":"request_demo_stop","manager_lock_wait_ms":1}},
    {"seq":11,"global_seq":11,"id":"evt_cx_011","at_ms":7002,"severity":"info","kind":"instant","name":"monitor.stop.accepted","component":"listener_manager","lane":"用户操作","flow_id":"flow_complex_target","task_id":"task_web_command_stop","goroutine_id":"g_http_webui_610","generation":1,"entity_id":"room_hmac_demo_target_042","attrs":{"request_to_accept_ms":2,"manager_lock_wait_ms":1},"links":[{"rel":"caused_by","event_id":"evt_cx_010"}]},
    {"seq":12,"global_seq":12,"id":"evt_cx_012","at_ms":7003,"severity":"info","kind":"instant","name":"task.cancel.requested","component":"listener","lane":"目标房间","flow_id":"flow_complex_target","task_id":"task_listener_waiter_g1","goroutine_id":"g_http_webui_610","generation":1,"entity_id":"room_hmac_demo_target_042","attrs":{"cancel_target":"listener.waiter.generation_1","context_owner":"listener.generation_1","does_not_cancel":"wrapped_live.scheduler.shared_request"},"links":[{"rel":"caused_by","event_id":"evt_cx_011"},{"rel":"cancels","event_id":"evt_cx_005"}]},
    {"seq":13,"global_seq":13,"id":"evt_cx_013","at_ms":7004,"severity":"info","kind":"state.transition","name":"listener.state.transition","component":"listener","lane":"目标房间","flow_id":"flow_complex_target","task_id":"task_listener_target_g1","goroutine_id":"g_http_webui_610","generation":1,"entity_id":"room_hmac_demo_target_042","attrs":{"from":"running","to":"stopped","cause":"manual_stop"}},
    {"seq":14,"global_seq":14,"id":"evt_cx_014","at_ms":7006,"severity":"info","kind":"span.end","name":"task.cancel.observed","component":"listener","lane":"目标房间","flow_id":"flow_complex_target","span_id":"span_poll_target_g1","task_id":"task_listener_waiter_g1","goroutine_id":"g_listener_target_g1","generation":1,"entity_id":"room_hmac_demo_target_042","status":"cancelled","attrs":{"ended_operation":"listener.poll","poll_no":1,"result_delivered":false,"cancel_observed":true,"cancel_target":"listener.waiter.generation_1"},"outcome":{"status":"cancelled","code":"listener.waiter_cancelled","duration_ms":6991},"links":[{"rel":"caused_by","event_id":"evt_cx_012"}]},
    {"seq":15,"global_seq":15,"id":"evt_cx_015","at_ms":7007,"severity":"debug","kind":"instant","name":"event.dispatch","component":"events","lane":"事件派发","flow_id":"flow_complex_target","task_id":"task_dispatch_listen_stop_g1","goroutine_id":"g_event_dispatch_401","dispatch_id":"dispatch_listen_stop_g1","generation":1,"entity_id":"room_hmac_demo_target_042","attrs":{"event_type":"ListenStop","handler_count":2},"links":[{"rel":"caused_by","event_id":"evt_cx_011"}]},
    {"seq":16,"global_seq":16,"id":"evt_cx_016","at_ms":7009,"severity":"debug","kind":"span.start","name":"event.handler.start","component":"events","lane":"事件派发","flow_id":"flow_complex_target","span_id":"span_handler_stop_recorder_g1","task_id":"task_dispatch_listen_stop_g1","goroutine_id":"g_event_dispatch_401","dispatch_id":"dispatch_listen_stop_g1","handler_id":"RecorderManager.OnListenStop","generation":1,"entity_id":"room_hmac_demo_target_042","attrs":{"handler_index":1}},